timestamp,latitude,longitude,zoom,image_description,image_prompt,image_model,text_description,text_prompt,text_model,danger2026-03-14T16:28:08.171020,41.8902,12.4922,16,"This image shows a satellite view of a city with a dense urban structure. The city appears to be a mix of residential and commercial areas, with buildings densely packed. There are a few open spaces, possibly parks or plazas, interspersed among the buildings. The roads are laid out in a grid-like pattern, with a few streets appearing to be major thoroughfares. There are no visible people or vehicles in the image, giving it a quiet, still appearance. The city is surrounded by what seems to be a large circular area, which could be a stadium or a significant public space. There are no visible bodies of water or large green spaces, suggesting the city is predominantly built up with very little vegetation. The image is in black and white, which adds to the starkness of the urban landscape.",Describe in detail what you see in this satellite image.,llava:7b,"N

There is no environmental danger present in this image, as there are no visible signs of pollution, contamination, or natural disasters. The city appears to be well-planned and organized, with a grid-like road pattern and open spaces. The lack of vegetation is likely due to the city being predominantly built-up, but this is not necessarily a danger. The overall appearance of the image is quiet and still, suggesting a peaceful and stable environment.","Based on the following satellite image description, is there any environmental danger present? Answer Y or N followed by a brief explanation.",llama3:8b,N
2026-03-14T16:34:33.189039,-13.1631,-72.545,16,"The image presents an aerial view of a lush, mountainous landscape. Dominating the scene is a winding road that cuts through the dense vegetation, leading towards the center of the image. The road, a lifeline of the region, is flanked by steep cliffs on both sides, creating a dramatic contrast with the surrounding greenery.

The vegetation itself is a vibrant mix of trees and bushes, their varying shades of green painting a picture of a thriving ecosystem. Patches of grass interspersed among the trees add to the diversity of the landscape.

On the right side of the image, a river snakes its way down the mountain, its path mirroring the road and carving a path for travelers. The river's presence adds a dynamic element to the otherwise static landscape, suggesting the constant flow of nature.

In the distance, a small village nestles among the mountains, its location marked by a distinctive orange roof that stands out against the green backdrop. The village, although small, adds a touch of human presence to the otherwise natural setting.

Overall, the image captures a moment of tranquility and natural beauty, where man-made structures like the road and village coexist harmoniously with the surrounding nature.",Describe in detail what you see in this satellite image.,llava:7b,"N

There is no environmental danger present in the image. The description portrays a thriving ecosystem, with a diverse landscape, a winding road, and a river that suggests a natural flow. The presence of a small village adds a human element, but it does not indicate any environmental hazards. The overall tone of the description is one of tranquility and natural beauty, with no indication of pollution, erosion, or other environmental dangers.","Based on the following satellite image description, is there any environmental danger present? Answer Y or N followed by a brief explanation.",llama3:8b,N
2026-03-14T16:40:32.583554,40.4319,116.5704,16,"The image shows a satellite view of a landscape. There are several distinct areas within the image. On the left side, there is a road that appears to be cutting through a dense forest or vegetation. The road is mostly straight and seems to be well-defined. In the middle of the image, there is a large, dark green area which could be a body of water, such as a lake or a large river. The water has a calm surface and is surrounded by a shoreline that is also green. On the right side of the image, there is a darker, brownish area that could be a different type of land cover, possibly a beach or a forest with less vegetation. The overall image has a natural landscape theme, with varying shades of green and brown. There are no visible texts or distinguishable objects in the image that provide additional context or information. The style of the image is a typical aerial or satellite photograph, providing an overview of the landscape from a top-down perspective.",Describe in detail what you see in this satellite image.,llava:7b,"N

There is no environmental danger present in the described satellite image. The image appears to show a natural landscape with various features such as a forest, water body, and possibly a beach or less vegetated area. The calm surface of the water and the absence of any visible signs of pollution or destruction suggest that the environment is not under threat.","Based on the following satellite image description, is there any environmental danger present? Answer Y or N followed by a brief explanation.",llama3:8b,N
2026-03-14T16:46:26.818879,29.9792,31.1342,16,"The satellite image presents an aerial view of an archaeological site situated in the middle of a desert landscape. The site is characterized by numerous mounds and ruins, some of which are enclosed within a boundary defined by a double wall. The ruins appear to be of an ancient civilization, with several structures, including what seems to be a tower, visible within the enclosure. The surrounding desert landscape is vast and largely devoid of vegetation, with only a few patches of greenery scattered around. There is a road running along the southern edge of the site, and a small settlement with houses can be seen near the northern boundary of the site. The sky above is overcast, suggesting a cloudy day. There are no visible texts or distinguishing marks that provide specific details about the site or its location. The image provides a clear view of the site's layout and the immediate surroundings, offering a glimpse into the historical and archaeological significance of the area.",Describe in detail what you see in this satellite image.,llava:7b,"N

There is no environmental danger present in the satellite image description. The description only mentions a desert landscape with a few patches of greenery, but no signs of pollution, natural disasters, or other environmental hazards. The overall tone of the description is focused on the archaeological significance of the site, with no indication of any environmental concerns.","Based on the following satellite image description, is there any environmental danger present? Answer Y or N followed by a brief explanation.",llama3:8b,N
2026-03-14T16:51:44.384983,13.4125,103.867,16,"The satellite image displays an aerial view of a large, rectangular man-made structure surrounded by water. This structure has multiple sections and appears to be a complex with various buildings and courtyards. The surrounding water body reflects a greenish hue, suggesting the presence of algae or vegetation, and there's a road or path cutting across the image leading to the main structure. The surrounding land area is covered with green vegetation and some bare areas. In the foreground, there's a small road or path that leads to the structure, and the overall scene is enclosed by a boundary that is partially visible. The image is a color photograph with natural and man-made elements.",Describe in detail what you see in this satellite image.,llava:7b,"N

There is no indication of environmental danger present in the image. The water body appears to be surrounded by vegetation, which suggests a healthy ecosystem. The greenish hue of the water may be due to algae or vegetation, which is a natural occurrence. The surrounding land area is also covered in vegetation, which further suggests a healthy environment.","Based on the following satellite image description, is there any environmental danger present? Answer Y or N followed by a brief explanation.",llama3:8b,N
