timestamp,latitude,longitude,zoom,image_description,image_prompt,image_model,text_description,text_prompt,text_model,danger
2026-03-14T21:33:16.216677,-11.5,-61.7,10,"The image you've provided appears to be a satellite image of a landscape, which shows a variety of land uses and natural features. Here's a breakdown of what I can observe:

1. **Land Use**: The image shows a mix of land uses, including agricultural fields, which are the most prominent, and areas that could be forested or undeveloped land. The agricultural fields are likely used for crop cultivation, as indicated by the pattern of fields and the presence of what appears to be crop rows.

2. **Vegetation Coverage**: The vegetation coverage is patchy, with areas of dense vegetation interspersed with open fields. The vegetation seems to be healthy, with a variety of shades of green indicating different types of plants.

3. **Signs of Deforestation or Forest Clearing**: There are no clear signs of deforestation or forest clearing in this image. The areas that could be forested are still present, and there are no large clearings or bare patches that would indicate recent deforestation.

4. **Human Infrastructure**: There are no visible signs of human infrastructure such as roads or buildings. The image is focused on the natural landscape and does not show any clear evidence of human activity.

5. **Mining Activity**: There are no visible signs of mining activity in this image. The landscape appears to be natural and undisturbed.","Describe this satellite image focusing on: land use, vegetation coverage, signs of deforestation or forest clearing, human infrastructure such as roads or buildings, mining activity, and any visible environmental degradation.",llava:7b,N: No signs of deforestation or forest clearing.,"You are an environmental analyst. Given this satellite image description, detect signs of HUMAN-CAUSED environmental damage. Key indicators include: grid-like roads cutting through forest, cleared rectangular fields surrounded by dense forest (deforestation), bare soil patches replacing vegetation, mining pits, or industrial pollution. Respond strictly in this format: 'Y: [reason]' or 'N: [reason]'. One sentence only. No other text.",llama3.2:3b,N
2026-03-14T21:36:13.726183,-11.5,-61.7,13,"The satellite image depicts a landscape with a mix of land use and vegetation coverage. The area is predominantly covered with a variety of green vegetation, indicating a healthy ecosystem. There are patches of bare land, which could suggest deforestation or forest clearing, particularly in the lower left quadrant of the image.

Human infrastructure, such as roads or buildings, is minimal and not clearly visible. There are no signs of mining activity in this image. The water bodies are scattered throughout the landscape, which could be natural or man-made water bodies.

The image does not show any signs of environmental degradation that are immediately apparent. The vegetation appears to be in good condition, and there are no visible signs of pollution or industrial activity. The overall impression is of a relatively natural landscape with some human-induced changes, particularly in the areas of deforestation or forest clearing.","Describe this satellite image focusing on: land use, vegetation coverage, signs of deforestation or forest clearing, human infrastructure such as roads or buildings, mining activity, and any visible environmental degradation.",llava:7b,Y: Bare land patches in the lower left quadrant could suggest deforestation or forest clearing.,"You are an environmental analyst. Given this satellite image description, detect signs of HUMAN-CAUSED environmental damage. Key indicators include: grid-like roads cutting through forest, cleared rectangular fields surrounded by dense forest (deforestation), bare soil patches replacing vegetation, mining pits, or industrial pollution. Respond strictly in this format: 'Y: [reason]' or 'N: [reason]'. One sentence only. No other text.",llama3.2:3b,Y
2026-03-14T21:39:33.092476,-12.9,-52.0,13,"The image you've provided appears to be a satellite image of a landscape, likely taken from a high altitude. Here's a description based on the visible features:

1. Land Use: The image shows a mix of land uses. There are areas that are predominantly covered with vegetation, which could be a mix of grasslands, pastures, or forests. There are also patches of water, which could be rivers or lakes.

2. Vegetation Coverage: The vegetation appears to be quite dense in some areas, indicating a healthy ecosystem. However, there are also areas where the vegetation is sparse, which could be indicative of deforestation or overgrazing.

3. Signs of Deforestation or Forest Clearing: There are areas where the vegetation has been cleared, creating a patchwork of green and brown areas. These cleared areas could be the result of deforestation for agriculture, infrastructure development, or other human activities.

4. Human Infrastructure: There are no clear signs of human infrastructure such as roads or buildings in this image. However, the presence of the patchwork vegetation pattern might suggest human activity, possibly related to agriculture or deforestation.

5. Mining Activity: There are no visible signs of mining activity in this image. The landscape appears to be more rural and natural in nature.

6. Environmental Degradation: The image","Describe this satellite image focusing on: land use, vegetation coverage, signs of deforestation or forest clearing, human infrastructure such as roads or buildings, mining activity, and any visible environmental degradation.",llava:7b,"Y: Signs of deforestation or forest clearing are visible, indicating human-caused environmental damage.","You are an environmental analyst. Given this satellite image description, detect signs of HUMAN-CAUSED environmental damage. Key indicators include: grid-like roads cutting through forest, cleared rectangular fields surrounded by dense forest (deforestation), bare soil patches replacing vegetation, mining pits, or industrial pollution. Respond strictly in this format: 'Y: [reason]' or 'N: [reason]'. One sentence only. No other text.",llama3.2:3b,Y
2026-03-14T21:43:31.621769,5.4,5.9,13,"The satellite image you've provided appears to be a Landsat image, which is commonly used for land use and vegetation analysis. Here's a breakdown of the elements visible in the image:

1. **Land Use**: The image shows a mix of land use types. There are areas with dense vegetation, which could be forests or other types of vegetation, and open areas that might be agricultural fields or grasslands.

2. **Vegetation Coverage**: The green areas indicate areas with dense vegetation, which could be forests or other types of vegetation. The green areas are interspersed with other land use types.

3. **Signs of Deforestation or Forest Clearing**: There are patches where the vegetation appears to be less dense, which could indicate areas where forests have been cleared or deforested. These patches are surrounded by the greener areas, suggesting they might be in the process of being cleared or are cleared areas.

4. **Human Infrastructure**: There are no clear signs of human infrastructure such as roads or buildings in this image. The roads and buildings are not visible due to the resolution of the satellite image.

5. **Mining Activity**: There are no visible signs of mining activity in this image. The image does not show any areas that are characteristic of mining operations, such as open pits or extraction sites.

6. **Environmental","Describe this satellite image focusing on: land use, vegetation coverage, signs of deforestation or forest clearing, human infrastructure such as roads or buildings, mining activity, and any visible environmental degradation.",llava:7b,Y: Signs of deforestation or forest clearing due to the presence of patches with less dense vegetation surrounded by greener areas.,"You are an environmental analyst. Given this satellite image description, detect signs of HUMAN-CAUSED environmental damage. Key indicators include: grid-like roads cutting through forest, cleared rectangular fields surrounded by dense forest (deforestation), bare soil patches replacing vegetation, mining pits, or industrial pollution. Respond strictly in this format: 'Y: [reason]' or 'N: [reason]'. One sentence only. No other text.",llama3.2:3b,Y
